{
  "schema_version": "1.0",
  "release": "0.7.0",
  "started_at": "2026-06-20T17:00:35.732880+00:00",
  "finished_at": "2026-06-20T17:00:59.805292+00:00",
  "environment": {
    "python": "3.13.5",
    "implementation": "CPython",
    "platform": "Linux-4.4.0-x86_64-with-glibc2.41",
    "architecture": "x86_64"
  },
  "scope": "Local checks only; excludes external datasets, services, reviewers, and signing credentials.",
  "status": "passed",
  "failed_checks": [],
  "skipped_checks": [],
  "checks": [
    {
      "name": "action-pins",
      "status": "passed",
      "returncode": 0,
      "duration_seconds": 0.042,
      "command": "'<PYTHON_BIN>/python' scripts/check_action_pins.py",
      "output_tail": "All external GitHub Actions are pinned to immutable commit SHAs.\n"
    },
    {
      "name": "workflow-yaml",
      "status": "passed",
      "returncode": 0,
      "duration_seconds": 0.085,
      "command": "'<PYTHON_BIN>/python' scripts/check_workflow_integrity.py '<PROJECT_ROOT>'",
      "output_tail": "GitHub Actions workflow YAML is valid and structurally complete.\n"
    },
    {
      "name": "schema-integrity",
      "status": "passed",
      "returncode": 0,
      "duration_seconds": 0.243,
      "command": "'<PYTHON_BIN>/python' scripts/check_schema_integrity.py '<PROJECT_ROOT>'",
      "output_tail": "Schema integrity check passed\n"
    },
    {
      "name": "dependency-locks",
      "status": "passed",
      "returncode": 0,
      "duration_seconds": 0.111,
      "command": "'<PYTHON_BIN>/python' scripts/check_dependency_locks.py '<PROJECT_ROOT>'",
      "output_tail": "Runtime dependency roots and hashed lock are synchronized.\n"
    },
    {
      "name": "installed-dependencies",
      "status": "passed",
      "returncode": 0,
      "duration_seconds": 0.466,
      "command": "'<PYTHON_BIN>/python' -m pip check",
      "output_tail": "WARNING: The directory '<HOME>/.cache/pip' or its parent directory is not owned or is not writable by the current user. The cache has been disabled. Check the permissions and owner of that directory. If executing pip with sudo, you should use sudo's -H flag.\nNo broken requirements found.\n"
    },
    {
      "name": "ruff",
      "status": "passed",
      "returncode": 0,
      "duration_seconds": 0.121,
      "command": "'<PYTHON_BIN>/python' -m ruff check .",
      "output_tail": "All checks passed!\n"
    },
    {
      "name": "ruff-format",
      "status": "passed",
      "returncode": 0,
      "duration_seconds": 0.119,
      "command": "'<PYTHON_BIN>/python' -m ruff format --check .",
      "output_tail": "132 files already formatted\n"
    },
    {
      "name": "compileall",
      "status": "passed",
      "returncode": 0,
      "duration_seconds": 0.118,
      "command": "'<PYTHON_BIN>/python' -m compileall -q src scripts tests",
      "output_tail": ""
    },
    {
      "name": "mypy",
      "status": "passed",
      "returncode": 0,
      "duration_seconds": 4.42,
      "command": "'<PYTHON_BIN>/python' -m mypy",
      "output_tail": "Success: no issues found in 74 source files\n"
    },
    {
      "name": "bandit-medium-high",
      "status": "passed",
      "returncode": 0,
      "duration_seconds": 1.119,
      "command": "'<PYTHON_BIN>/python' -m bandit -q -r src scripts -ll",
      "output_tail": "[tester]\tWARNING\tnosec encountered (B608), but no failed test on file src/dicom_privacy_auditor/benchmark/midi.py:212\n[tester]\tWARNING\tnosec encountered (B608), but no failed test on file src/dicom_privacy_auditor/benchmark/midi.py:212\n[tester]\tWARNING\tnosec encountered (B608), but no failed test on file src/dicom_privacy_auditor/benchmark/midi.py:216\n[tester]\tWARNING\tnosec encountered (B608), but no failed test on file src/dicom_privacy_auditor/benchmark/midi.py:224\n[tester]\tWARNING\tnosec encountered (B608), but no failed test on file src/dicom_privacy_auditor/benchmark/midi.py:224\n[tester]\tWARNING\tnosec encountered (B608), but no failed test on file src/dicom_privacy_auditor/benchmark/midi.py:446\n"
    },
    {
      "name": "tests-and-coverage",
      "status": "passed",
      "returncode": 0,
      "duration_seconds": 11.23,
      "command": "'<PYTHON_BIN>/python' -m pytest -p pytest_cov --cov=dicom_privacy_auditor --cov-report=term-missing --cov-fail-under=82",
      "output_tail": "........................................................................ [ 49%]\n........................................................................ [ 99%]\n.                                                                        [100%]\n=============================== warnings summary ===============================\ntests/test_distribution_policy.py::test_distribution_policy_rejects_embedded_keys_duplicates_and_links\n  <PYTHON_RUNTIME>/lib/python3.13/zipfile/__init__.py:1642: UserWarning: Duplicate name: 'package/duplicate.txt'\n    return self._open_to_write(zinfo, force_zip64=force_zip64)\n\n-- Docs: https://docs.pytest.org/en/stable/how-to/capture-warnings.html\n================================ tests coverage ================================\n_______________ coverage: platform linux, python 3.13.5-final-0 ________________\n\nName                                                Stmts   Miss  Cover   Missing\n---------------------------------------------------------------------------------\nsrc/dicom_privacy_auditor/__init__.py                   5      0   100%\nsrc/dicom_privacy_auditor/adapter_cli.py               45      7    84%   39-45, 51-62, 68\nsrc/dicom_privacy_auditor/adapters/__init__.py          4      0   100%\nsrc/dicom_privacy_auditor/adapters/base.py             11      0   100%\nsrc/dicom_privacy_auditor/adapters/directory.py        49      4    92%   41, 50, 66, 86\nsrc/dicom_privacy_auditor/adapters/factory.py          16      4    75%   13, 15, 17, 20\nsrc/dicom_privacy_auditor/adapters/orthanc.py         128     23    82%   26, 28, 55, 59, 70, 77, 79, 106, 111-112, 118, 121, 123-128, 150, 155, 175-176, 179\nsrc/dicom_privacy_auditor/adapters/rsna.py             85     14    84%   49, 51, 54, 59, 65-66, 71, 81-82, 87, 95, 99-100, 121\nsrc/dicom_privacy_auditor/adapters/util.py             86     26    70%   24, 36, 42, 49, 56, 66-73, 84, 86, 92, 94, 98, 108, 113, 115, 118-122\nsrc/dicom_privacy_auditor/audit.py                    129     13    90%   45-46, 171, 201-202, 217, 379, 432-433, 457-459, 488\nsrc/dicom_privacy_auditor/benchmark/__init__.py         3      0   100%\nsrc/dicom_privacy_auditor/benchmark/evaluate.py       215     12    94%   123, 127-128, 130, 147, 154-155, 160-161, 187, 219, 393\nsrc/dicom_privacy_auditor/benchmark/manifest.py        74      1    99%   79\nsrc/dicom_privacy_auditor/benchmark/midi.py           503     81    84%   83, 87, 91, 148-149, 164-166, 173, 262, 265-266, 268-269, 285-287, 292, 301, 303, 306, 311-312, 362-373, 384, 389-391, 414, 416, 424-426, 432, 443, 452, 471, 473, 476-477, 479, 481, 500-503, 562, 575, 577, 580, 585-586, 599, 607-609, 630, 632, 636-637, 684-685, 688, 697-698, 748, 791-794, 796-798\nsrc/dicom_privacy_auditor/benchmark/report.py          39      1    97%   17\nsrc/dicom_privacy_auditor/benchmark/runner.py         195     58    70%   37, 39, 44, 57, 111-113, 149, 151-153, 200-202, 212, 249, 251, 253-255, 296-358\nsrc/dicom_privacy_auditor/benchmark/synthetic.py      187     11    94%   103, 159-162, 237, 250-251, 329-331\nsrc/dicom_privacy_auditor/benchmark_cli.py            108     12    89%   95-98, 106, 147-148, 158-160, 171, 175\nsrc/dicom_privacy_auditor/campaign/__init__.py          2      0   100%\nsrc/dicom_privacy_auditor/campaign/cli.py             107     23    79%   120-128, 130-132, 134-138, 140-146, 148-157, 159-161, 163-177, 213\nsrc/dicom_privacy_auditor/campaign/evidence.py        294     40    86%   56, 70, 130, 135, 137, 189, 192, 196-200, 209, 215, 246, 248, 253, 273, 279, 287, 305, 308-309, 313, 317, 331, 352, 361, 363, 369, 379-380, 434, 445, 447, 459, 472, 475-477\nsrc/dicom_privacy_auditor/campaign/midi_live.py       274     52    81%   63-64, 84, 91, 102, 105, 131, 133, 136, 139-140, 147, 162, 185, 197, 199, 217, 252, 262, 266, 273, 321, 336, 355-376, 382-388, 392, 396-402, 409-412, 415, 422\nsrc/dicom_privacy_auditor/cli.py                       48      5    90%   50-52, 61, 100\nsrc/dicom_privacy_auditor/compare.py                   66      6    91%   154-155, 167-168, 189-190\nsrc/dicom_privacy_auditor/compare_cli.py               29      2    93%   40, 46\nsrc/dicom_privacy_auditor/corpus/__init__.py            3      0   100%\nsrc/dicom_privacy_auditor/corpus/cli.py                41     11    73%   36-57, 63\nsrc/dicom_privacy_auditor/corpus/evaluate.py          159     19    88%   42, 52, 61-75, 95, 97, 116-118, 187, 239\nsrc/dicom_privacy_auditor/corpus/models.py             29      0   100%\nsrc/dicom_privacy_auditor/data/__init__.py              0      0   100%\nsrc/dicom_privacy_auditor/deidentify.py               117      6    95%   101-103, 105-108, 113\nsrc/dicom_privacy_auditor/deidentify_cli.py            17      1    94%   38\nsrc/dicom_privacy_auditor/demo.py                      74      8    89%   41-43, 60-63, 152\nsrc/dicom_privacy_auditor/desktop.py                  235    199    15%   22-27, 31, 36-142, 145-151, 154-158, 161-165, 168-196, 199-214, 219-234, 237-268, 271-301, 304-309, 312-313, 329-356, 360\nsrc/dicom_privacy_auditor/detectors.py                 67     11    84%   30, 34, 50, 61, 63, 67, 69, 71, 78, 80, 82\nsrc/dicom_privacy_auditor/dicomweb/__init__.py          2      0   100%\nsrc/dicom_privacy_auditor/dicomweb/cli.py              56      8    86%   33-36, 62, 65-66, 74\nsrc/dicom_privacy_auditor/dicomweb/client.py          247     50    80%   57, 59, 80, 139-142, 144-150, 170-171, 173-174, 176-181, 204, 220, 222, 235-241, 244-256, 261, 286, 307, 310-312, 336, 339, 345, 360-361\nsrc/dicom_privacy_auditor/export.py                    26      2    92%   64-65\nsrc/dicom_privacy_auditor/exte